	0	
22790	 'Ein Mann habe ihm beispielsweise gesagt, es sei „nur noch eine Frage der Zeit, bis Blut spritzt.“ Im Ernstfall müssen solche Paare an andere Beratungsstellen verwiesen werden. Zum Glück sind das die seltensten Fälle. Rund zwei Drittel der Teilnehmer können die Gewalt laut Marcel Kruse erfolgreich beenden, sei es durch eine erfolgreiche Therapie oder durch Trennung. Nur das letzte Drittel beendet die Beratung vorzeitig. Seine Erfahrungen ermutigen Kruse, weiterzumachen: „Man sagt ja oft: Wer einmal schlägt, schlägt immer wieder. Ich bin jedes Mal froh, wenn ein Paar das Gegenteil beweist.“	
11218	 'Gäbe es weniger Gewalt, wenn die Gesellschaft mit Frauenfreundlicher wäre?	
12825	 'Derzeit prüfen die Kantone, ob Personen, die bereits Opfer häuslicher Gewalt wurden, im Rahmen eines Pilotprojektes auf Wunsch ein Notfallknopf zur Verfügung gestellt werden kann. Dieser soll über ein speziell angepasstes Mobiltelefon, eine App oder die Smartwatch laufen. Geplant ist ausserdem eine zentrale Telefonnummer für die Opferhilfe.Und ab nächstem Jahr können im Kanton Zürich bei Stalkern und Gewalttätern elektronische Fussfesseln eingesetzt werden, um festzustellen, wo sie sich aufhalten. Früher sei Frauen oft nichts anderes übrig geblieben, als in einem Frauenhaus Schutz zu suchen, sagt Gloor. «Die Frauen wurden eingeschränkt, nicht die Gewalt ausübenden Männer.» Heute sei das anders. «Es hat ein Paradigmenwechsel stattgefunden.»	
21666	 'Zum x-ten mal erklärt man das Virus, seine Verbreitungswege und warum es so wichtig ist, auf Distanz zu gehen. „Als ob das jetzt interessant wäre…“ hört man das Gegenüber nölen. Doch, ist es, hat es zu sein, hält man verärgert gegen. Hat aber gleichzeitig Verständnis, schließlich war man selbst mal 15. Artikelkarussell Corona-Koller	
7554	 '„Wir stehen ganz am Anfang der Verhandlungen“, betont Lisa Kappes-Sassano, die Leiterin der Caritas Fils-Neckar-Alb. „Zunächst wird versucht, Fördermittel über Bundesprogramme zu akquirieren.“ Denn das Gebäude, das der Verband langfristig anmieten will, müsste erst noch barrierefrei umgebaut werden. Einen Großteil der Investitionskosten könnte die öffentliche Hand übernehmen. Eine Förderanfrage beim Bund wurde laut Eininger fristgerecht Anfang April dieses Jahres gestellt, die Antwort wird in diesen Tagen erwartet. Bei einer positiven Rückmeldung könne die Caritas den Förderantrag bis spätestens 31. März nächsten Jahres einreichen. Kappes-Sassano schätzt, dass mit der Eröffnung des Hauses frühestens 2024 zu rechnen ist.']	
4152	 'Die Kantonspolizei nimmt zu den Vorwürfen nicht Stellung. Das tut dafür ihr oberster Chef, Regierungsrat Mario Fehr. Von Versagen könne keine Rede sein. «Wir machen immer alles Menschenmögliche.»	
21755	 'Hilfe für Opfer häuslicher Gewalt	
18798	 'Es ist evident, dass Männer, die aus patriarchal geprägten Kulturen kommen, in denen Frauen untergeordnet sind, eine andere Vorstellung von Gewalt haben.	
11598	 'Der Kreis Segeberg hat im Dezember 2020 die Finanzierung von fünf weiteren Plätzen bis Ende 2021 bewilligt. „Die Nachfrage ist immer hoch, und jetzt in der Pandemie steigt sie noch einmal stark an“, sagt Claudia Meyer, Gleichstellungsbeauftragte der Stadt. Mit dem Frauenhaus arbeitet sie eng zusammen und weiß über die bestehenden Nöte: „Hier und da werden zusätzliche Mittel zur Verfügung gestellt, aber das Frauenhaus braucht unbedingt dauerhaft mehr finanzielle Unterstützung. Das Frauenhaus hat gerade erst öffentlich um Spenden gebeten, um das Projekt ‚Männlich geht anders‘ weiterführen zu können.“ Es könnte nicht sein, dass beispielsweise die so wichtige und erfolgreiche Betreuung der Jungen durch eine männliche Fachkraft, die dazu auch noch eine Vorbildfunktion hat, in dieser Krise von Spenden abhängig ist, so die Gleichstellungsbeauftragte. HA	
12044	 'Zwölf ehrenamtliche Mitarbeiter, von denen wie der Außenstellenleiter viele früher für die Polizei tätig waren, arbeiten im Kreis für den Weißen Ring. Zwei Mitarbeiter sehen ihre Hauptaufgabe in der Prävention. Diese lag jedoch 2020 wegen der Pandemiebeschränkungen teilweise brach. Auch die persönlichen Kontakte zwischen den Hilfesuchenden und den Opferhelfern konnten nicht wie gewohnt erfolgen. Laut Kleinig wurde das persönliche Treffen durch Telefongespräche oder Mail- sowie Messengerkontakte ersetzt, die Betreuung der Klienten habe aber nicht gelitten.	
18503	 'Wenn Sozialwissenschaftler eines Tages ihre Arbeiten über die Proteste in Belarus schreiben, werden sie auf die Frauen schauen müssen. Es war eine Frau, die Lukaschenko herausgefordert hat – Swetlana Tichanowskaja kandidierte anstelle ihres verhafteten Mannes und wurde sogar zugelassen, weil man sie nicht ernst nahm, sie war ja »nur« eine Frau. Zwei weitere Ehefrauen nicht zugelassener Kandidaten sprangen Tichanowskaja bei und einten die Oppositionskräfte. Und nun sind es die Frauen, die immer wieder die Proteste schützen, wenn Gewalt droht.	
8873	 '']	
22249	 'Die Zahlen sind alarmierend: Allein im Jahr 2018 starben in der Schweiz 24 Frauen und 3 Männer infolge häuslicher Gewalt. Zudem gab es 52 versuchte Tötungen. Justizministerin Karin Keller-Sutter will nun stärker eingreifen. «Ich bin nicht bereit, solche Taten einfach so hinzunehmen», sagt sie im BaZ-Interview zum Jahreswechsel. Die FDP-Bundesrätin will deshalb bei einem verfügten Kontaktverbot in Fällen häuslicher Gewalt nicht nur den Täter mit einer elektronischen Fussfessel ausstatten. Auch das Opfer soll überwachungstechnisch ausgerüstet werden. «Es hätte eine Art Tracker, der einen Alarm auslöst, wenn sich der Gefährder nähert. Das Opfer könnte sich dann entfernen und die Polizei verständigen.» Keller-Sutter sieht darin eine Alternative zur Echtzeitüberwachung, welche die Kantone ablehnen, weil sie zu aufwendig und teuer ist.	
13574	 'Häusliche Gewalt sowie Morde an Frauen sind ein großes Problem in der Türkei. Obwohl sich die juristischen Bedingungen für Opfer nach Angaben von Frauenrechtsaktivistinnen zuletzt verbessert haben, kommen die Taten weiterhin nur selten vor Gericht. Aktivistinnen machen dafür die patriarchalen Strukturen der Gesellschaft verantwortlich.	
2085	 'Nach der Einvernahme ging Ammann erschöpft und früh ins Bett. Mitten in der Nacht weckte ihn Lärm vor der Tür. Als er öffnete, stürmte die Polizei die Wohnung. «Sie setzen sich ins Wohnzimmer und verhalten sich ruhig», habe einer der Polizisten ihn angeschrien. Später stellten sie fest, dass es ein Fehlalarm war, und zogen ab. Offenbar hatte seine Frau versehentlich eine Freundin angerufen, sei aber bei den Rückrufen nicht rangegangen. «Und die Schlussfolgerung war, dass ich, der Frauenschläger, sie gerade verprügle.» Da war für Ammann klar: So wollte er nicht weiterleben.	
18636	 'Körperliche Gewalt vor allem an Grundschulen Über das Internet diffamiert, belästigt, bedrängt, bedroht oder genötigt wurden Lehrkräfte an 32 Prozent der Schulen, wieder sind die vom VBE als Haupt-, Real- und Gesamtschulen bezeichneten Schulformen dabei führend (an Grundschulen waren es 20 Prozent, an Gymnasien 46 Prozent). 2018 lag der Durchschnittswert auch hierbei mit 20 Prozent deutlich niedriger.	
4104	 'Solche sogenannten Femizide sorgen für Empörung, aber die allermeisten Taten in den eigenen vier Wänden sorgen nicht für grosse Medienberichte. Sie bleiben der Öffentlichkeit verborgen. Die Zahlen jedoch sind alarmierend: Im vergangenen Jahr kam es im Kanton Zürich zu rund 5300 Einsätzen – täglich musste die Polizei also fast 15 Mal wegen häuslicher Gewalt ausrücken. Auch die Zahl der registrierten Fälle hat deutlich zugenommen. Gegenüber dem Vorjahr stieg 2018 die Zahl der Strafanzeigen um 15 Prozent.	
8807	 'Die schottische Regierungschefin Nicola Sturgeon (50) hat sich für einen Verstoß gegen die Corona-Regeln entschuldigt. Sie hatte sich am Rande einer Beerdigung in Edinburgh zwar mit Abstand, aber ohne Mund-Nase-Schutz mit drei Frauen unterhalten. In Schottland ist das Tragen einer Maske in Gaststätten vorgeschrieben, außer am Sitzplatz. „Das war ein dummer Fehler, und es tut mir wirklich leid“, sagte Sturgeon am Dienstagabend. Die Zeitung The Scottish Sun hatte ein Foto der Szene vom Freitag veröffentlicht. „Ich spreche jeden Tag über die Wichtigkeit, Masken zu tragen. Ich habe falsch gehandelt, ich ärgere mich über mich selbst“, betonte Sturgeon. Die Strafe für solche Verstöße beträgt 60 Pfund (66 Euro), die sich im Wiederholungsfall vervielfacht. 	