	0	
14582	" 'Die Polizei war zunächst von einer Anwohnerin gerufen worden, weil eine Frau vor einem Haus in Erbach nach Hilfe gerufen habe. Kurz zuvor hatte es an der Adresse bereits einen Einsatz wegen häuslicher Gewalt gegeben. Vor Ort seien die beiden Streifenbesatzungen unmittelbar von etwa zehn Menschen ""feindselig empfangen und bedroht"" worden, hieß es in der Mitteilung. Die Polizei setzte Pfefferspray ein, zudem fiel der Schuss. Bei der Auseinandersetzung wurde ein Mann leicht verletzt, er und vier weitere wurden vorläufig festgenommen. Weitere Details waren zunächst nicht bekannt."	
20413	 'Die Polizei wurde in der Zeit des Corona-Shutdowns in Potsdam häufiger als im Vergleichszeitraum des Vorjahres wegen häuslicher Gewalt gegen Frauen und Kinder alarmiert. Das hat Stefanie Wagner-Leppin, die Sprecherin der zuständigen Polizeidirektion West, auf MAZ-Anfrage bekannt gegeben.	
14372	 'Der Ausschluss aus dem Europarat und die eilfertig von russischen Politikern angekündigte schnelle Kündigung der EMRK und anderer Vereinbarungen werden sich ohne Zweifel auf die russische Bevölkerung auswirken. Das stärkste Argument gegen den immer wieder in Strassburg erörterten Ausstieg Russlands aus der Organisation war stets der Zugang zum EGMR.	
13805	['Das Schweizer Sexualstrafrecht muss revidiert werden. Das fordern 22 Strafrechtsprofessoren.	
19568	 'Wie erfahren Sie derzeit von Verdachtsfällen?	
15669	" '""Es wurden keine Verletzungen an ihr festgestellt"""	
7339	 'Im Bereich häuslicher Gewalt, die sich in den meisten Fällen gegen Frauen und Kinder richtet, wird die Dunkelziffer von Experten genrell als hoch eingeschätzt. Bereits Ende März hatte der Europarat auf Frankreich verwiesen, wo viele Frauen wegen der Beschränkungen keine Notrufstellen anrufen könnten.	
10815	 'Nach Angaben des Frauenministeriums hatten zuletzt alle bis auf zwei der Einrichtungen angezeigt, noch über freie Plätze zu verfügen. Obwohl die Gewalt innerhalb der Familien deutlich zunahm, habe es „seit der Pandemie bis dato keine überdurchschnittlichen Aufnahmen von Frauen in den Brandenburger Schutzeinrichtungen“ gegeben, heißt es in der Stellungnahme der Landesregierung.	
23222	 '„Das kenne ich von zu Hause, ist doch ganz normal“ – auch solche Sätze hören Seifert und Hagemann immer wieder. Sie versuchen dann abseits der Gruppe nachzuhaken: Wird zu Hause viel gestritten? Schreit dabei jemand, schlägt, wirft mit Gegenständen? Erlebt das Kind Gewalt, möglicherweise sogar am eigenen Körper? Die Pädagog:innen müssen dann abwägen: Droht den Kindern akute Gefahr, muss die Schule direkt das Jugendamt einschalten. Meist wird aber erst einmal ein Gespräch mit den Eltern angebahnt.	
22124	['Es rumort gewaltig zwischen den Vertreterinnen der Frauenhilfe und der zuständigen Senatsverwaltung für Gleichstellung. Im Haushalt gibt es zwar mehr Geld für den Schutz von Opfern häuslicher Gewalt. Aber an der Praxis vorbei, sagen die Akteurinnen	
9652	 'Paten für ein Stück Blumenwiese gesucht	
22532	 'Sturm und Schnee in Spanien	
8729	" 'Frankreichs Präsident Macron erklärte, die Polizisten hätten ""ihr Leben eingesetzt"", um eine Frau zu retten, die ""Opfer von Gewalt in der Ehe"" geworden sei. ""Sie sind unsere Helden"", schrieb Macron über die Gendarmen auf Twitter."	
2222	 'Schon Ende vergangenen Jahres ist ein weiteres Buch erschienen, in dem es um Gewalt gegen Frauen geht: „Politische Männlichkeit: Wie Incels, Fundamentalisten und Autoritäre für das Patriarchat mobilmachen“ von Susanne Kaiser. Kaiser holt wesentlich weiter aus, sie beschreibt Incels, Amerikas zornige weiße Männer und häusliche Gewalt, den gemeinsamen Nenner findet sie in gekränkten Besitzansprüchen, bloß eben nicht wie bei Backes und Bettoni auf einer persönlichen Ebene, sondern als gesellschaftliches Phänomen. Kaiser sieht in Anschlägen auf Frauen Akte politischer Gewalt. Die sogenannten Incels, die „involuntary celibates“, sind eine lose Gruppierung heterosexueller Männer, die sich im Internet zusammenfinden - in den drei wichtigsten amerikanischen Foren sollen dem kanadischen Fernsehen zufolge 60 000 aktiv sein. Die Grenzen zum Rechtsradikalismus sind bei den Incels fließend, vor allem aber finden sie, die Gesellschaft habe ihnen Frauen vorenthalten, auf die sie einen Anspruch hatten. So wie es die Männer der Überlebenden in „Alle drei Tage“ auch sehen.	
10575	 'Spanien will Quarantäne für Einreise schon eher aufheben	
6315	 'Die Corona-Krise hat nach Angaben des bayerischen Landeskriminalamtes (LKA) bislang nicht zu mehr bekannten Fällen häuslicher Gewalt geführt - entgegen anders lautenden Befürchtungen. „Vermutungen, dass die Corona-Krise das Problem häuslicher Gewalt verschärfen könnte, weil zerstrittene Eheleute oder Partner nun viel Zeit gemeinsam zu Hause verbringen, bestätigen sich zumindest bislang nicht“, teilte das LKA am Dienstag in München mit. Die Fallzahlen bei häuslicher Gewalt seien „in diesem Jahr unauffällig und teilweise sogar rückläufig“. Allerdings lägen „abschließend belastbare Zahlen dazu“ noch nicht vor.	
10977	['Erste Zahlen aus Niederösterreich bestätigen die Befürchtungen. Gewaltschutzzentren verzeichneten enormen Zulauf.	
19802	 'Jetzt haben sich die zwei Regierungsbeauftragten für Opfer von Kriminalität und häuslicher Gewalt in England zusammengetan. In einer Online-Sitzung des Innenausschusses im Parlament warnten sie: Die steigende Zahl ermordeter Frauen sei das Sinnbild dieser Krise. Sie fordern, die Zeitspanne zu verlängern, in der Opfer die Täter anzeigen könnten. Nach britischem Gesetz muss das innerhalb von sechs Monaten geschehen. Aber viele Frauen, hiess es im Innenausschuss, riefen in der aktuellen Lage nicht die Polizei. «Weil sie gefangen seien in ihrer Situation.»	
1108	 'Sie beschreiben Ihre Beratung als „proaktiv“, was heißt das genau?	
10841	" '""Ich habe meine Vergangenheit nur erwähnt, weil ich wie jeder andere Mensch auf diesem Planeten eine komplexe Hintergrundgeschichte habe."" Dies präge ihre Ängste, Interessen und Meinungen, schrieb Rowling zum Schluss ihres Textes. ""Ich vergesse diese innere Komplexität nie, wenn ich eine fiktive Figur erschaffe, und ich vergesse sie nie, wenn es um Trans-Menschen geht."" Sie sei äusserst glücklich. ""Ich bin eine Überlebende und sicherlich kein Opfer.""']"	
4834	 'Die Polizeibehörden verteidigen sich gegen die Vorwürfe. Viele Beamte reagierten angemessen auf Berichte von häuslicher Gewalt, betonte Fabienne Boulard von der Nationalpolizei. Diejenigen, die das nicht täten, handelten nicht böswillig, sondern seien schlicht nicht der Lage, die Fälle zu erkennen, oder wüssten nicht, wie sie intervenieren sollten.	
15445	 'Bericht: Anwälte raten Trump von Befragung durch Sonderermittler ab	
9749	 'Die neue Amazon-Doku Lorena von Regisseur Joshua Rofé lässt in vier etwa einstündigen Folgen Lorena und John Wayne heute neben Anwälten, Jurymitgliedern und Journalisten zu Wort kommen und bedient sich am umfangreichen Originalmaterial. Da sie ihre Collage nicht weiter kommentiert, bringt sie Zuschauer zunächst in eine unangenehme Position. Der Fall fordert geradezu dazu auf, Partei zu ergreifen, doch zunächst steht Wort gegen Wort. Heute würde man sagen, zwei Narrative konkurrieren. Im einen ist John Wayne Bobbitt ein harmloser Dummkopf, den seine rach- und eifersüchtige Frau verstümmelt. Im anderen weiß sich Lorena nach unzähligen Demütigungen nicht anders zu helfen, als gewissermaßen die Waffe ihres Vergewaltigers zu zerstören. Der Medienrummel um den Fall scheint nicht nur die Entwicklung zu voyeuristischer wie atemloser Live-Skandalisierung vorweggenommen zu haben, sondern auch das postfaktische Zeitalter.	
9226	 'Das bedeutet, die Täter können auch Männer aus dem eigenen Umfeld sein – der Kollege im Büro, der eigene Bruder, der eigentlich so fürsorgliche Partner. Es können sogar Männer sein, die sich selbst als Feministen bezeichnen würden, weil sie prinzipiell schon dafür sind. Das ist keine Verharmlosung von Häuslicher Gewalt, im Gegenteil, denn es verweist auf eine Struktur gesellschaftlicher Machtverhältnisse. Eine Struktur, die vom öffentlichen in den intimsten Winkel des Privaten greift: in die eigene Beziehung.	
20376	['Stress, Frust, Enge: Während bei Notfallhotlines in der Krise mehr Menschen anrufen, sehen Behörden keinen Anstieg häuslicher Gewalt. Weil vieles im Verborgenen passiert.	
12710	 '\n                     Klicken Sie, um das Video zu sehen\n                  	
14803	 'Auch die von der Polizei erfasste politisch motivierte Kriminalität ist gesunken - von 6098 Fällen um fünf Prozent auf 5799 Fälle. Allerdings war 2020 ein Rekordjahr, trotz des Rückgangs war es 2021 die zweithöchste Zahl seit 2012. Vor allem stieg die Zahl\xa0politisch motivierter Gewalttaten – um 14 Prozent auf 1037. Die Zahl rechtsmotivierter Taten sank von 2500 auf 1990 Fälle, die Zahl linksmotivierter Taten von 2150 auf 1500 Fälle.	
22176	['Mobbing, körperliche Gewalt, Aggressionen: In der Stadt ist die Gefahr, Opfer von Gewalt an Schulen zu werden größer als auf dem Land. Die meisten Aggressionen gehen im Norden von Jungen aus. Bildungsministerin Prien warnt davor, das Thema zu tabuisieren.	
1483	 'Sie ist mit dem Vater des jüngsten Kindes zwar verheiratet, doch das Paar lebt räumlich getrennt. Somit versorgt Frau T. die Kinder alleine und kann mit ihnen auch nicht zu ihrem Ehemann ziehen. Deshalb hat das Ordnungsamt der Gemeinde, in der Frau T. und die Kinder leben, eine Ersatzunterkunft mit drei Zimmern angeboten. Die befindet sich im Obdachlosenheim. Die Möbel aus der vom Schimmel befallenen Wohnung darf die Familie dorthin nicht mitnehmen. Deshalb benötigen Frau T. und die Kinder Betten, Bettzeug, einen Schreibtisch für die Schularbeiten und einen Wohnzimmerschrank. Frau T. lebt von Arbeitslosengeld II und vom Unterhalt für das Jüngste. Die beiden ältesten Kinder haben kein eigenes Einkommen.']	
17694	 '']	
16235	 'Was sich 1968 international ereignete, bewegte auch Basel: der Vietnamkrieg, die Ermordung des amerikanischen Bürgerrechtlers Martin Luther King und der Einmarsch sowjetischer Truppen in die Tschechoslowakei. «Hoch die internationale Solidarität» skandierten Empörte an Kundgebungen. «Revolution» sangen die Beatles. Ansteckend. Regionales kam hinzu.	
5953	 'Das Projekt hat seine Grenzen	
18910	 '# Notizblock	
6279	['Brandenburg	
23031	 'Kann man mit einer Schizophrenie dennoch gut leben?	
5998	 'Kommentar 	
501	 'Was hat das mit Ihnen gemacht?	
12079	 'Der DRK-Sprecher Siekmann bestätigt die gute Zusammenarbeit: „Die Unterstützung vom Landkreis ist sehr gut, auch die Finanzierung.“ Er sieht, wie Böhm auch, eher ein gesamtgesellschaftliches Problem, das sich nicht pauschal mit mehr Plätzen lösen lasse: den angespannten Wohnungsmarkt. „Nicht die Anzahl der Zimmer ist das primäre Problem, sondern die fehlenden Möglichkeiten einer bezahlbaren Unterbringung nach einem Aufenthalt im Frauenhaus“, erklärt der Pressesprecher. Das führe zu einer langen Verweildauer, Frauen müssten Plätze dauerhaft in Anspruch nehmen.	
10459	 'Neuerdings bietet der Frauennotruf auch Beratungsspaziergänge an für Klientinnen, die schon länger in Kontakt mit den Sozialpädagoginnen sind. „Walk and Talk“ nennt Trapp dieses Angebot, bei dem ein Gespräch im Gehen an der frischen Luft auch ohne Mundschutz stattfinden könne.	
8195	 'Das System, das am meisten missbräuchlich verwendet wird, ist ohne Frage das Handy. Jeder hat eines – heutzutage ist unser ganzes Leben damit verbunden. Wenn man an eher unkonventionelle Technologien denkt, sind das häufig jene, die sehr populär und erschwinglich sind.Jess Lowe Photography	
10820	 'Zustimmung kommt von der Gleichstellungsbeauftragten des Landes. Die Finanzierung sei so wie derzeit „nicht auskömmlich“, kritisiert Manuela Dörnenburg. Nach dem Koalitionsvertrag will die Landesregierung „Frauenhäuser, Frauenberatungsstellen, Zufluchtswohnungen erhalten und weiterentwickeln“. Wenn es aber nicht gelinge, die vorhandene Struktur in der Krise zu erhalten, müsse man „nicht darüber reden, sie auszubauen“, so Dörnenburg. Deshalb müsse die Finanzierung gesichert werden.	
2404	 'Somit stellt sich noch die Frage nach der völkerrechtlichen Beurteilung. Also darum, ob man es einfach hinnehmen muss, dass ein „Vertreter ohne Vertretungsmacht“ Verträge im Namen seines Volkes aufkündigen kann, die von solch grundlegender Bedeutung für das Land sind. Der deutsche Außenminister und Vorsitzende des Ministerkomitees des Europarates, Heiko Maas, und der Präsident der Parlamentarischen Versammlung, Rik Daems, haben sich der Erklärung der zuständigen Generalsekretärin, Marija Pejcinovic Buric, angeschlossen und ihr Bedauern zum Austritt der Türkei erklärt. Sie betonten dabei, dass die Konvention damals einstimmig vom türkischen Parlament angenommen, aber ohne deren Beteiligung aufgekündigt wurde.	
5709	 'Die registrierten Fälle häuslicher Gewalt haben in Baden-Württemberg in den letzten Jahren stetig zugenommen: 2019 zählte die Polizei 13\xa0048 Fälle, im Jahr 2011 waren es hingegen noch 10\xa0872 Taten, wie der Vorsitzende des Innenausschusses des Landtags, Karl Klein (CDU), am Mittwochabend in Stuttgart mitteilte. Dies ist ein Plus von 2176 Fällen. Die Zahl der Opfer sei im selben Zeitraum um 2180 Personen gestiegen. Während der Corona-Krise gab es demnach aber keine außergewöhnliche Zunahme registrierter Fälle.	
3739	" 'Als das Schreiben der Anwältin eingeht, nimmt das Amtsgericht Grevenbroich, dem die Kindesentführung und die Morddrohungen bekannt gewesen sein sollen, Kontakt zu Haydar A. auf. Er soll seine Sicht der Dinge schildern. Bis zum 31. Oktober. Haydar A. bestreitet die Vorwürfe und bedrängt seine Frau weiter. Am 18. Oktober ruft Shmsi A. erneut die Polizei. Die Anwältin teilt das dem Gericht mit, drängt auf eine schnellere Entscheidung. Die Richter aber ändern ihr Vorgehen nicht. Dann sticht Haydar A. zu. Einen Tag später, als Shmsi A. schwer verwundet im Krankenhaus liegt und nach Haydar A. gefahndet wird, beschließt das Amtsgericht den Gewaltschutz für Shmsi A. ""Ein Hohn"", sagt Cakir-Ceylan. Und: ""Hätte das Gericht so gehandelt, wie es müsste, dann hätte diese Tat vielleicht verhindert werden können."" Nur: Das Gericht hat genau so gehandelt, wie es musste. Und das ist das Problem."	
14897	 'Vor dem Gericht des Bezirks Fairfax im Bundesstaat Virginia erklärte die Psychologin, sie habe für ihr Gutachten unter anderem Gesundheitsakten und Audioaufnahmen geprüft und sei zweimal mit der Schauspielerin für Tests zusammengetroffen. Dabei sei sie auch zu dem Schluss gekommen, dass Heard wegen der Beziehung zu dem «Fluch der Karibik»-Star nicht an einer posttraumatischen Belastungsstörung leide. «Frau Heard litt nicht an PTBS, und es gab auch ziemlich deutliche Hinweise darauf, dass sie Symptome einer PTBS erheblich übertrieb, als sie danach gefragt wurde», sagte Curry.	
15127	 'Auch die Fakten, die bisher vorliegen, helfen Heard nicht. Sie hat eine Vorgeschichte. 2009 nahm die Polizei sie wegen eines vermeintlichen Angriffs auf ihre damalige Freundin fest, Anklage wurde allerdings nicht erhoben.	
18583	 'Sie verlangte einen verstärkten Dialog mit den Experten im Gewaltschutzbereich und ein Soforthilfepaket von fünf Millionen Euro für die Betroffenen. Weiters trat Heinisch-Hosek ein Mal mehr für Hochrisiko-Fallkonferenzen ein, die hoch gefährliche Fälle analysieren und beraten sollten.']	
19927	 'Dass die Justiz währen der Pandemie sehr verlangsamt funktioniert, kann dagegen zu einem Hindernis werden – auch wenn Justizministerin Nicole Belloubet versichert, die Verhandlung der Fälle häuslicher Gewalt und die richterliche Anordnung von Schutzmaßnahmen bleibe eine „Priorität“.	
2386	['Pauline Voss	
20283	 'Indes hatte Waltraud Kuhne, Sozialdezernentin der Kreisverwaltung in Neuruppin, vor einer Woche darauf verwiesen, dass die Zahl der gemeldeten Fälle von häuslicher Gewalt in Ostprignitz-Ruppin im Vergleich zum Vorjahr gesunken sei. av	
20702	 'Fisch gegen Sex	
6888	 'So sanken die Gewaltdelikte etwa in Sachsen von 317 auf 226 Fälle. Ein Grund war hier, dass die Zahlen im Vorjahr durch die rechten Chemnitz-Unruhen hochgeschnellt waren. Einzig Berlin registrierte einen deutlichen Zuwachs: von 309 auf 390 Taten – Höchststand seit Gründung des Projekts im Jahr 2001. Sabine Seyb vom dortigen Projekt ReachOut sprach von einer „Enttabuisierung und Enthemmung der Gewalt auf ausgegrenzte Bevölkerungsgruppen“. Dies zeige sich auch daran, dass vermehrt direkt Wohnräume angegriffen würden. Die Täter fühlten sich offenbar durch laufende rassistische Debatten oder einen institutionellen Rassismus der Behörden motiviert.	
23470	 'Interessierte Fördernehmer können sich seit heute um die Fördergelder bewerben. Weitere Details online unter:  \n                  ']	
12311	['Die Kriminalstatistik 2020 verzeichnet mehr politisch motivierte Kriminalität. Corona senkt die Wohnungseinbrüche und ist womöglich Ursache für mehr häusliche Gewalt.	
11886	['Ambulante Pflege und Betreuung. Beratungstelefon der Caritas unter _08171/983010 oder E-Mail: cs-geretsried@caritasmuenchen.de, Caritaszentrum, Graslitzer Straße 13.	
15719	 'Heute ist der Tag der Frauen. Schön wäre es, wenn 2018 zum Jahr der Frauen wird. Ich glaube daran. Denn die Zeit ist reif. Und die Vorschläge liegen auf dem Tisch. Für mehr Sicherheit für unsere Frauen. Für mehr Lohn. Für mehr Chancen.	
9912	" 'In der Nacht zum Montag startete die südafrikanische Sängerin Bongekile Simelane, Künstlername Babes Wodumo, ein Live-Video für ihre 1,5 Millionen Follower auf Instagram. Nach kurzer Zeit war zu sehen, wie sie ohne Eile ein paar Schritte von der Kamera wegging. Den Mann hinter sich schien sie nicht zu bemerken. Dieser nahm regelrecht Anlauf und schlug ihr mit voller Wucht ins Gesicht. ""Ungishaleyani?"", rief Simelane auf Zulu, was so viel wie ""Warum schlägst du mich?"" bedeutet. Die Antwort: ein weiterer Hieb."	
14649	 'Justizministerin Jacqueline Bernhardt (Linke) bemerkte dazu, dass nach wie vor überwiegend Frauen und Mädchen von häuslicher und sexualisierter Gewalt betroffen seien. Zudem gebe es bereits ein gut ausgebautes und funktionierendes Beratungs- und Hilfenetz in Mecklenburg-Vorpommern. Alle Einrichtungen - ausgenommen Frauenhäuser - würden unabhängig vom Geschlecht eines Hilfesuchenden beraten, unterstützen und helfen. Es bestehe zwar noch Handlungsbedarf, Männer und Jungen stärker in den Blick zu nehmen, man sei dabei aber schon auf gutem Weg.	
15331	 'Zudem gebe es 50 sogenannte Zweite-Stufe-Wohnungen mit rund 145 Plätzen für Frauen und ihre Kinder. Dort werden Frauen aufgenommen, die die engmaschige und umfassende Betreuung und Beratung eines Frauenhauses, also einer Schutzunterkunft, nicht mehr benötigen.	
17782	" '""Ich wünsche mir, dass alle Frauen ihre Feminität und ihren Körper feiern können""Dass sie für eine paritätische Besetzung politischer und wirtschaftlicher Gremien stimmen, dass sie sich für gleiche Bezahlung stark machen. Dass sie aber auch einschreiten, wenn sie sogenanntes Catcalling mitbekommen und als das Geißeln was es ist: verbale sexuelle Belästigung. Dass Femizide und misogyne Gewalt auch von Männern laut und deutlich verurteilt werden!"	
13351	 'Mittwoch, 24. November	
5971	 '\nKlicken Sie, um das Bild zu sehen \n	
4400	['Rebekka Haefeli	
17596	" 'Hier sieht die Polizei schon einen Zuwachs der Fallzahlen bei Kindern (von 17 auf 34) und Jugendlichen (von 67 auf 83). Als Gründe vermutet die Polizei die Ausfälle von Schule und anderen Freizeitaktivitäten. Insgesamt gab es 1920 Fälle. Nur jeder fünfte Fall wird aufgeklärt. ""Es handelt sich um schwer aufklärbare Delikte, oft ohne Zeugen oder ein großartiges Spurenbild"", sagt Weimann."	
13498	 '„Wir setzen damit ein klares Zeichen gegen Gewalt an Frauen und zeigen, dass wir die betroffenen Frauen nicht allein lassen, sondern ihnen immer und überall den Rücken stärken“, sagt Rempe. „Wir alle sind aufgerufen, nicht wegzusehen, sondern deutlich zu machen, dass Gewalt gegen Frauen in jeder Form inakzeptabel ist“, betont der Landrat. Er erinnert daran, dass Gewalt gegen Frauen viele Erscheinungsformen hat – von häuslicher Gewalt über die sexuelle Belästigung von Frauen am Arbeitsplatz bis hin zu Stalking.	
7305	" 'Hilbert verwies darauf, dass neben den 80 zugelassenen Teilnehmern auch Polizisten und mutmaßliche Gegendemonstranten vor Ort sein dürften. Das Ordnungsamt begrenzte die Demo auf eine Dauer von 30 Minuten. Pegida hatte am Sonntag im Internet bekanntgeben, nach ""konstruktiver Abstimmung mit der Versammlungsbehörde und dem Gesundheitsamt"" eine Sondergenehmigung bekommen zu haben. Nach der sächsischen Corona-Schutz- Verordnung sind Ansammlungen untersagt, allerdings können Ausnahmegenehmigungen erteilt werden. Pegida ist ein Sammelbecken rassistischer und völkische Kräfte, auch der radikal rechte AfD-Politiker Björn Höcke trat schon bei den montäglichen Veranstaltungen auf. Anführer Lutz Bachmann wird von Verfassungsschutz-Chef Thomas Haldenwang ebenso wie Höcke als ""Rechtsextremist"" bezeichnet."	
10290	" 'Heute seien die zehn Plätze für Frauen und sieben Plätze für Kinder oft ausgebucht, heisst es im Vorstoss. Akut gewaltbetroffene Frauen müssten deswegen oft abgewiesen werden, mahnte die Ratslinke. Ein internationales Abkommen ergebe für das bikantonale Frauenhaus ein Soll von 49 Plätzen; nötig seien also zusätzliche 32 Plätze."	
1743	 'Die Kampagne der Konferenz der Kantonalen Sozialdirektorinnen und Sozialdirektoren (SODK) und des Eidgenössischen Büros für die Gleichstellung von Frau und Mann (EBG) richtet sich zum einen gezielt an jugendliche Opfer elterlicher Gewalt und zum anderen an Erwachsene und ältere Menschen, die von häuslicher Gewalt betroffen sind. Dies geht aus einer Mitteilung des Bundes vom Mittwoch hervor.	
3588	 'In Genf, Athen und Madrid beteiligten sich hunderte meist weibliche Demonstranten an den Kundgebungen. Der Protestmarsch in der spanischen Hauptstadt am Samstagabend wurde von lautem Trommeln begleitet. In vielen Städten gingen die Proteste am Sonntag weiter. In Spanien, darunter in Madrid, Barcelona, Sevilla, Valencia, Bilbao oder Pamplona ging die Zahl der Teilnehmerinnen erneut in die Tausende.	
18132	['Ich bin ein bisschen erschöpft. Aufklärungsfatigue, Rebellionsdepression, nennen Sie es, wie Sie wollen. Fünf Monate Gespräche und Interviews zum Thema „Häusliche Gewalt“ mit den immer gleichen Fragen, dem gleichen, ungläubigen Erstaunen, den üblichen Anmerkungen und den immer aufs Neue heruntergeleierten Uralt-Mythen, es ist kaum auszuhalten.	
11606	 'Die Nachricht vom Anfang ist Bestandteil dieses Coachings. An dem fiktiven Beispiel sollen Berater:innen lernen, wie man im Chat kurzfristig helfen kann, selbst bei psychischen Problemen. Entstanden ist das Start-up im Homeoffice, während des ersten Lockdowns. Dann musste es schnell gehen. „Wir haben das Flugzeug quasi beim Fliegen gebaut“, sagt Eckert. Finanziert wird das Projekt nach eigenen Angaben aus privaten Mitteln, „ein bisschen Crowdfunding“ und von Kooperationspartnern wie der Barmer Krankenkasse.	
9038	['Auf Instagram spricht die ehemalige DSDS-Teilnehmerin über ihre Erfahrungen mit häuslicher Gewalt und verrät, wie sie den Absprung von ihrem gewalttätigen Ex-Freund schaffte.	
8909	['Eine stattliche Summe von 31 225,55 Euro hat sich bis zum Ende des vergangenen Jahres in der Sterntaler-Kasse angesammelt.	
15239	" 'Der Schriftstellerverband PEN-Deutschland hat nach dem überraschenden Rücktritt seines bisherigen Präsidenten Deniz Yücel einen Notvorstand gewählt. Die im thüringischen Gotha tagende Mitgliederversammlung stimmte mit großer Mehrheit für den österreichischen Schriftsteller Josef Haslinger als Interims-Präsidenten. Er soll die Neuwahl eines Präsidiums vorbereiten, die ""in einigen Monaten"" stattfinden werde. Nach einer turbulenten Sitzung, in dessen Zuge WELT-Autor Yücel zunächst knapp im Amt als Präsident bestätigt worden war, dann aber selbst zurück- und aus dem Verband austrat, war auch der verbliebene Vorstand zurückgetreten. Hintergrund ist ein Streit im bisherigen Vorstand sowie Kritik am Führungsstil einzelner Vorstandsmitglieder. Die Hintergründe lesen Sie auf ."	
12090	 'Waller-Krappen: Man muss der betroffenen Person ja die Zeit geben, sich Rechtsschutz zu suchen.	
7217	 'Und Sie betonen das, weil das viele Menschen nicht sehen?	
22289	 '«Schon heute darf sich ein Mann nicht über das Nein einer Frau hinwegsetzen.»	
4845	 'Basiswissen auch für nicht Betroffene bieten drei Expertinnen: Ingrid Röhling, vom Ordnungsamt Leonberg informiert über Wohnungsverweis und e rechtliche Möglichkeiten. Karin Zimmermann berichtet über die Beratungsstelle bei häuslicher Gewalt „Frauen helfen Frauen“. Monika Becker, die Leiterin der Beratungsstelle gegen sexuelle Gewalt „Thamar“, stellt das Angebot von Thamar vor und berichtet über den Stand eines neuen Frauen- und Kinderschutzhauses für den Kreis Böblingen. Der Eintritt ist frei. arno']	
503	" 'Sie haben zirka 18 Jahre Beziehungsleben hinter sich mit wechselnden, unpassenden Partnern. Sie schreiben selber, Sie können ""schlechte Beziehungen echt gut"". Wieso haben Sie aus negativer Erfahrung nicht gelernt?"	
